Topic Number,Topic Name
0,"Protest in Colombia, police violence"
1,"Government and politician, Government violence"
2,People discussing about national strike and livelihood
3,"Preference, desire, wish for equality"
4,Financial concerns relating to tax/ government policy
5,People believe that there are corruption and kills
6,People are accusing the president of being associated with narcos (drugs). This is being publicised in socials
7,"Dictatorship in Colombia.Citizens, possibly the young, are missing from the streets, Citizens should be defended"
